Asus B850 MAX GAMING WIFI W ATX AM5 Motherboard,https://cdna.pcpartpicker.com/static/forever/images/product/41fc6d471b31d1e2031cc34c217aa30d.256p.jpg,https://pcpartpicker.com/product/MCvscf/asus-b850-max-gaming-wifi-w-atx-am5-motherboard-b850-max-gaming-wifi-w,21194.0,Asus,B850 MAX GAMING WIFI W,AM5,ATX,AMD B850,256 GB,DDR5,4,"DDR5-4800, DDR5-8000",White,4.0,,,,,"2280 M-key, 2280 M-key, 2242/2260/2280/22110 M-key",,,,,4.0,1 x 2.5 Gb/s Ports (Realtek),No,3.0,,1.0,1.0,,No,Wi-Fi 6E,Yes,2026-01-20T11:23:44.341Z
ASRock B650 Pro RS WiFi ATX AM5 Motherboard,https://cdna.pcpartpicker.com/static/forever/images/product/ccef8c9b5cad8a1a27840cb7082b4bcb.256p.jpg,https://pcpartpicker.com/product/Lnrqqs/asrock-b650-pro-rs-wifi-atx-am5-motherboard-b650-pro-rs-wifi,16347.0,ASRock,B650 Pro RS WiFi,AM5,ATX,AMD B650,256 GB,DDR5,4,"DDR5-4400, DDR5-4800, DDR5-5200, DDR5-5600, DDR5-6000, DDR5-6200, DDR5-6400, DDR5-6600, DDR5-6800, DDR5-7000, DDR5-7200",Silver / Black,2.0,,,1.0,,"2280 M-key, 2242/2260/2280 M-key, 2260/2280 M-key",,,,,4.0,1 x 2.5 Gb/s Ports (Realtek Dragon RTL8125BG),Depends on CPU,1.0,1.0,1.0,,1.0,No,Wi-Fi 6E,Yes,2026-01-20T11:23:50.336Z
Gigabyte Z790 AORUS PRO X WIFI7 ATX LGA1700 Motherboard,https://cdna.pcpartpicker.com/static/forever/images/product/4e8ba034d57bfbc8dec7ce683eac3e92.256p.jpg,https://pcpartpicker.com/product/TDXV3C/gigabyte-z790-aorus-pro-x-wifi7-atx-lga1700-motherboard-z790-aorus-pro-x-wifi7,30794.0,Gigabyte,Z790 AORUS PRO X WIFI7,LGA1700,ATX,Intel Z790,256 GB,DDR5,4,"DDR5-4000, DDR5-4800, DDR5-5200, DDR5-5400, DDR5-5600, DDR5-5800, DDR5-6000, DDR5-6200, DDR5-6400, DDR5-6600, DDR5-6800, DDR5-7000, DDR5-7200, DDR5-7400, DDR5-7600, DDR5-7800, DDR5-7900, DDR5-7950, DDR5-8000, DDR5-8200, DDR5-8266",Black,3.0,,,,,"2580/25110 M-key, 2280/22110 M-key, 2280/22110 M-key, 2280 M-key, 2280 M-key",,,,,4.0,1 x 5 Gb/s Ports (Realtek),Depends on CPU,2.0,,1.0,,1.0,No,Wi-Fi 7,Yes,2026-01-20T11:23:58.329Z
Asus ROG STRIX B450-F GAMING ATX AM4 Motherboard,https://cdna.pcpartpicker.com/static/forever/images/product/66e5b5e4d0a52b6a2f99bb53bf52eee7.256p.jpg,https://pcpartpicker.com/product/XQgzK8/asus-rog-strix-b450-f-gaming-atx-am4-motherboard-strix-b450-f-gaming,15180.0,Asus,STRIX B450-F GAMING,AM4,ATX,AMD B450,128 GB,DDR4,4,"DDR4-2133, DDR4-2400, DDR4-2666, DDR4-2800, DDR4-3000, DDR4-3200",Black,3.0,,,3.0,,"2242/2260/2280 M-key, 2242/2260/2280/22110 M-key",,,,,6.0,1 x 1 Gb/s Ports,Depends on CPU,2.0,,1.0,,,No,,Yes,2026-01-20T11:24:05.329Z
Gigabyte B850 EAGLE WIFI7 ICE ATX AM5 Motherboard,,https://pcpartpicker.com/product/rBqNnQ/gigabyte-b850-eagle-wifi7-ice-atx-am5-motherboard-b850-eagle-wifi7-ice,33646.0,Gigabyte,B850 EAGLE WIFI7 ICE,AM5,ATX,AMD B850,256 GB,DDR5,4,"DDR5-4400, DDR5-4800, DDR5-5200, DDR5-5600, DDR5-5800, DDR5-6000, DDR5-6200, DDR5-6400, DDR5-6600, DDR5-6800, DDR5-7000, DDR5-7200, DDR5-7400, DDR5-7600, DDR5-7800, DDR5-7900, DDR5-7950, DDR5-8000, DDR5-8200",White,4.0,,,,,"2280/22110 M-key, 2280/22110 M-key, 2280/22110 M-key",,,,,4.0,1 x 2.5 Gb/s Ports (Realtek),Depends on CPU,2.0,,1.0,1.0,,No,Wi-Fi 7,Yes,2026-01-20T11:24:11.342Z
Asus TUF GAMING B850-BTF WIFI W ATX AM5 Motherboard,https://cdna.pcpartpicker.com/static/forever/images/product/2560b9984c5667f9e7d893a89b71a9c7.256p.jpg,https://pcpartpicker.com/product/NXRnTW/asus-tuf-gaming-b850-btf-wifi-w-atx-am5-motherboard-tuf-gaming-b850-btf-wifi-w,31645.0,Asus,TUF GAMING B850-BTF WIFI W,AM5,ATX,AMD B850,256 GB,DDR5,4,"DDR5-4800, DDR5-8000",White / Silver,1.0,,,1.0,,"2280 M-key, 2242/2260/2280/22110 M-key, 2280 M-key",,,,,4.0,1 x 2.5 Gb/s Ports (Realtek),Depends on CPU,2.0,,1.0,1.0,,No,Wi-Fi 7,Yes,2026-01-20T11:24:17.336Z
Gigabyte X870E AORUS MASTER ATX AM5 Motherboard,https://m.media-amazon.com/images/I/518Fz24TzPL.jpg,https://pcpartpicker.com/product/PdsV3C/gigabyte-x870e-aorus-master-atx-am5-motherboard-x870e-aorus-master,43206.0,Gigabyte,X870E AORUS MASTER,AM5,ATX,AMD X870E,256 GB,DDR5,4,"DDR5-4400, DDR5-4800, DDR5-5200, DDR5-5600, DDR5-6000, DDR5-6200, DDR5-6400, DDR5-6600, DDR5-6666, DDR5-6800, DDR5-7000, DDR5-7200, DDR5-7600, DDR5-7800, DDR5-8000, DDR5-8200",Black,3.0,,,,,"2580/25110 M-key, 2280/22110 M-key, 2280/22110 M-key, 2280/22110 M-key",,,,,4.0,1 x 5 Gb/s Ports (Realtek),Depends on CPU,2.0,,2.0,,1.0,No,Wi-Fi 7,Yes,2026-01-20T11:24:23.330Z
MSI X870 GAMING PLUS WIFI ATX AM5 Motherboard,https://cdna.pcpartpicker.com/static/forever/images/product/d12159191629629d3c107e4bbe7607c1.256p.jpg,https://pcpartpicker.com/product/xFfV3C/msi-x870-gaming-plus-wifi-atx-am5-motherboard-x870-gaming-plus-wifi,23354.0,MSI,X870 GAMING PLUS WIFI,AM5,ATX,AMD X870,256 GB,DDR5,4,"DDR5-3600, DDR5-4800, DDR5-5200, DDR5-5600, DDR5-6400",Black / White,4.0,,,,,"2260/2280 M-key, 2280/22110 M-key, 2260/2280 M-key, 2230 E-key",,,,,4.0,1 x 5 Gb/s Ports (Realtek 8126VB),Depends on CPU,2.0,,1.0,1.0,,No,Wi-Fi 7,Yes,2026-01-20T11:24:29.330Z
Asus ROG STRIX X870E-H GAMING WIFI7 HATSUNE MIKU EDITION ATX AM5 Motherboard,https://cdna.pcpartpicker.com/static/forever/images/product/40eb512adea85ba4dc671cf7b5d80eba.256p.jpg,https://pcpartpicker.com/product/fDm2FT/asus-rog-strix-x870e-h-gaming-wifi7-hatsune-miku-edition-atx-am5-motherboard-rog-strix-x870e-h-gaming-wifi7-hatsune-miku-edition,67261.0,Asus,rog-strix-x870e-h-gaming-wifi7-hatsune-miku-edition,AM5,ATX,AMD X870E,256 GB,DDR5,4,"DDR5-4800, DDR5-8000",Black / Blue,2.0,,,,,"2242/2260/2280 M-key, 2280/22110 M-key, 2280 M-key, 2280 M-key",,,,,4.0,1 x 5 Gb/s Ports (Realtek),Depends on CPU,2.0,,1.0,,1.0,No,Wi-Fi 7,Yes,2026-01-20T11:24:35.338Z
MSI PRO B650-A WIFI ATX AM5 Motherboard,,https://pcpartpicker.com/product/V7tLrH/msi-pro-b650-a-wifi-atx-am5-motherboard-pro-b650-a-wifi,22368.0,MSI,PRO B650-A WIFI,AM5,ATX,AMD B650,256 GB,DDR5,4,"DDR5-4800, DDR5-5000, DDR5-5200, DDR5-5400, DDR5-5600, DDR5-5800, DDR5-6000, DDR5-6200, DDR5-6400, DDR5-6600, DDR5-6800, DDR5-7000, DDR5-7200, DDR5-7400, DDR5-7600",Black / Silver,2.0,,,1.0,,"2280/22110 M-key, 2260/2280 M-key, 2260/2280 M-key",,,,,6.0,1 x 2.5 Gb/s Ports (Realtek RTL8125B),Depends on CPU,2.0,,1.0,1.0,,No,Wi-Fi 6E,Yes,2026-01-20T11:24:41.340Z
ASRock G41M-GS Micro ATX LGA775 Motherboard,,https://pcpartpicker.com/product/3WR48d/asrock-motherboard-g41mgs,,ASRock,G41M-GS,LGA775,Micro ATX,Intel G41,8 GB,DDR2,2,DDR2-1066,Blue / White,1.0,,,1.0,2.0,,,,,,,1 x 1 Gb/s Ports,Yes,2.0,,,,,No,,No,2026-01-20T11:24:47.329Z
Asus ROG STRIX B850-E GAMING WIFI ATX AM5 Motherboard,https://m.media-amazon.com/images/I/518Anf1ta6L.jpg,https://pcpartpicker.com/product/FQZWGX/asus-rog-strix-b850-e-gaming-wifi-atx-am5-motherboard-rog-strix-b850-e-gaming-wifi,66175.0,Asus,ROG STRIX B850-E GAMING WIFI,AM5,ATX,AMD B850,256 GB,DDR5,4,"DDR5-4800, DDR5-8000",Black,2.0,,,,,"2242/2260/2280 M-key, 2242/2260/2280 M-key, 2280 M-key, 2280 M-key, 2280 M-key",,,,,4.0,1 x 5 Gb/s Ports (Realtek),Depends on CPU,2.0,,1.0,1.0,,No,Wi-Fi 7,Yes,2026-01-20T11:24:53.339Z
MSI MAG X670E TOMAHAWK WIFI ATX AM5 Motherboard,https://cdna.pcpartpicker.com/static/forever/images/product/c4516e2f81a19d4c9045028a3bae013b.256p.jpg,https://pcpartpicker.com/product/bGfxFT/msi-mag-x670e-tomahawk-wifi-atx-am5-motherboard-mag-x670e-tomahawk-wifi,41688.0,MSI,MAG X670E TOMAHAWK WIFI,AM5,ATX,AMD X670E,192 GB,DDR5,4,"DDR5-4800, DDR5-5000, DDR5-5200, DDR5-5400, DDR5-5600, DDR5-5800, DDR5-6000, DDR5-6200, DDR5-6400, DDR5-6600",Black,3.0,,,1.0,,"2280/22110 M-key, 2260/2280 M-key, 2260/2280 M-key, 2260/2280 M-key",,,,,4.0,1 x 2.5 Gb/s Ports (Realtek RTL8125BG),Depends on CPU,2.0,,2.0,1.0,,No,Wi-Fi 6E,Yes,2026-01-20T11:25:01.328Z
ASRock B850M Steel Legend WiFi Micro ATX AM5 Motherboard,https://cdna.pcpartpicker.com/static/forever/images/product/b79a4103bd136cf3dcfcfdb299453e0e.256p.jpg,https://pcpartpicker.com/product/qxYfrH/asrock-b850m-steel-legend-wifi-micro-atx-am5-motherboard-b850m-steel-legend-wifi,17687.0,ASRock,B850M Steel Legend WiFi,AM5,Micro ATX,AMD B850,256 GB,DDR5,4,"DDR5-4400, DDR5-6400, DDR5-7200, DDR5-7600, DDR5-8000",Silver / Black,1.0,,1.0,,,"2280 M-key, 2260/2280 M-key, 2260/2280 M-key, 2230 E-key",,,,,4.0,1 x 2.5 Gb/s Ports (Realtek Dragon RTL8125BG),Depends on CPU,2.0,,2.0,1.0,,No,Wi-Fi 7,Yes,2026-01-20T11:25:07.339Z
MSI PRO B840-P WIFI ATX AM5 Motherboard,https://cdna.pcpartpicker.com/static/forever/images/product/93d5075a8c12fbe641b5bb67f4a4fd3b.256p.jpg,https://pcpartpicker.com/product/TvVfrH/msi-pro-b840-p-wifi-atx-am5-motherboard-pro-b840-p-wifi,18683.0,MSI,PRO B840-P WIFI,AM5,ATX,AMD B840,256 GB,DDR5,4,"DDR5-4800, DDR5-5600, DDR5-6400, DDR5-8000",Silver,5.0,,,,,"2260/2280 M-key, 2260/2280/22110 M-key",,,,,4.0,1 x 2.5 Gb/s Ports (Realtek 8125D),Depends on CPU,2.0,,1.0,1.0,,No,Wi-Fi 7,Yes,2026-01-20T11:25:15.329Z
Asus TUF GAMING B760-PLUS WIFI ATX LGA1700 Motherboard,https://cdna.pcpartpicker.com/static/forever/images/product/bc0dae2e2b9ee30cfad6a2b8da8d8da3.256p.jpg,https://pcpartpicker.com/product/LqkH99/asus-tuf-gaming-b760-plus-wifi-atx-lga1700-motherboard-tuf-gaming-b760-plus-wifi,16347.0,Asus,TUF GAMING B760-PLUS WIFI,LGA1700,ATX,Intel B760,192 GB,DDR5,4,"DDR5-4400, DDR5-4800, DDR5-5200, DDR5-5600, DDR5-6000, DDR5-6200, DDR5-6400",Black,2.0,,,2.0,,"2242/2260/2280 M-key, 2242/2260/2280/22110 M-key, 2242/2260/2280 M-key",,,,,4.0,1 x 2.5 Gb/s Ports (Realtek),Depends on CPU,2.0,,1.0,1.0,,No,Wi-Fi 6,Yes,2026-01-20T11:25:22.335Z
MSI PRO B860M-A WIFI Micro ATX LGA1851 Motherboard,https://cdna.pcpartpicker.com/static/forever/images/product/6c74beb5c52c860a45a3c0a014e85e70.256p.jpg,https://pcpartpicker.com/product/629nTW/msi-pro-b860m-a-wifi-micro-atx-lga1851-motherboard-pro-b860m-a-wifi,19851.0,MSI,PRO B860M-A WIFI,LGA1851,Micro ATX,Intel B860,256 GB,DDR5,4,"DDR5-4800, DDR5-8600",Silver / Black,4.0,,,,,"2242/2260/2280 M-key, 2260/2280 M-key, 2280 M-key",,,,,4.0,1 x 5 Gb/s Ports (Realtek 8126),Depends on CPU,2.0,,2.0,1.0,,No,Wi-Fi 7,Yes,2026-01-20T11:25:28.332Z
Asus ROG STRIX B450-F GAMING II ATX AM4 Motherboard,https://cdna.pcpartpicker.com/static/forever/images/product/0f27bb84f57d51a9cb2b0c91d25efb0f.256p.jpg,https://pcpartpicker.com/product/xYvqqs/asus-rog-strix-b450-f-gaming-ii-atx-am4-motherboard-rog-strix-b450-f-gaming-ii,,Asus,ROG STRIX B450-F GAMING II,AM4,ATX,AMD B450,128 GB,DDR4,4,"DDR4-2133, DDR4-2400, DDR4-2666, DDR4-2800, DDR4-3000, DDR4-3200, DDR4-3466, DDR4-3600, DDR4-3866, DDR4-4000, DDR4-4400",Black,3.0,,,3.0,,"2242/2260/2280 M-key, 2242/2260/2280/22110 M-key",,,,,6.0,1 x 1 Gb/s Ports (Intel I211-AT),Depends on CPU,1.0,,1.0,,,No,,Yes,2026-01-20T11:25:34.337Z
Asus PRIME H610I-PLUS D4-CSM Mini ITX LGA1700 Motherboard,https://cdna.pcpartpicker.com/static/forever/images/product/0910ab20a011a742b9fcf2f1aab43c8d.256p.jpg,https://pcpartpicker.com/product/M6t9TW/asus-prime-h610i-plus-d4-csm-mini-itx-lga1700-motherboard-prime-h610i-plus-d4-csm,19971.0,Asus,PRIME H610I-PLUS D4-CSM,LGA1700,Mini ITX,Intel H610,64 GB,DDR4,2,"DDR4-2133, DDR4-2400, DDR4-2666, DDR4-2800, DDR4-2933, DDR4-3000, DDR4-3200",Silver / Black,1.0,,,,,"2260/2280 M-key, E-key",,,,,4.0,1 x 1 Gb/s Ports (Realtek),Depends on CPU,1.0,,1.0,,,No,,No,2026-01-20T11:25:40.332Z
Gigabyte B850I AORUS PRO Mini ITX AM5 Motherboard,https://cdna.pcpartpicker.com/static/forever/images/product/eaf7d7e4417a44ec7b73e8da2a29142b.256p.jpg,https://pcpartpicker.com/product/FwVfrH/gigabyte-b850i-aorus-pro-mini-itx-am5-motherboard-b850i-aorus-pro,30360.0,Gigabyte,B850I AORUS PRO,AM5,Mini ITX,AMD B850,128 GB,DDR5,2,"DDR5-4400, DDR5-4800, DDR5-5200, DDR5-5600, DDR5-5800, DDR5-6000, DDR5-6200, DDR5-6400, DDR5-6600, DDR5-6800, DDR5-7000, DDR5-7200, DDR5-7400, DDR5-7600, DDR5-7800, DDR5-7900, DDR5-7950, DDR5-8000, DDR5-8200, DDR5-8400",,1.0,,,,,"2280 M-key, 2280 M-key",,,,,2.0,1 x 2.5 Gb/s Ports (Realtek),Depends on CPU,1.0,,1.0,1.0,,No,Wi-Fi 7,Yes,2026-01-20T11:25:46.330Z
MSI Z270-A PRO ATX LGA1151 Motherboard,https://cdna.pcpartpicker.com/static/forever/images/product/fe329be147afc26ea9a6ce0a10f7c3e0.256p.jpg,https://pcpartpicker.com/product/KvvZxr/msi-z270-a-pro-atx-lga1151-motherboard-z270-a-pro,24406.0,MSI,Z270-A PRO,LGA1151,ATX,Intel Z270,64 GB,DDR4,4,"DDR4-2133, DDR4-2400, DDR4-2800, DDR4-3000, DDR4-3200, DDR4-3600",Brown / Black,2.0,,,4.0,,2242/2260/2280/22110 M-key,,,,,6.0,1 x 1 Gb/s Ports,Depends on CPU,2.0,,2.0,,,No,,Yes,2026-01-20T11:25:52.337Z
Asus Z890 AYW GAMING WIFI W ATX LGA1851 Motherboard,https://cdna.pcpartpicker.com/static/forever/images/product/a7627ce734924502f021fb3435ae7f51.256p.jpg,https://pcpartpicker.com/product/T3V2FT/asus-z890-ayw-gaming-wifi-w-atx-lga1851-motherboard-z890-ayw-gaming-wifi-w,28784.0,Asus,Z890 AYW GAMING WIFI W,LGA1851,ATX,Intel Z890,256 GB,DDR5,4,"DDR5-4800, DDR5-6400, DDR5-8600",White,4.0,,,,,"2280/22110 M-key, 2280 M-key, 2280/22110 M-key, 2280 M-key",,,,,4.0,1 x 2.5 Gb/s Ports (Realtek),Depends on CPU,2.0,,2.0,,1.0,No,Wi-Fi 6,Yes,2026-01-20T11:25:58.329Z
MSI B850 GAMING PRO WIFI6E ATX AM5 Motherboard,https://cdna.pcpartpicker.com/static/forever/images/product/a6c8c68d676cc7ecf78ebcfae15e4365.256p.jpg,https://pcpartpicker.com/product/gnCCmG/msi-b850-gaming-pro-wifi6e-atx-am5-motherboard-b850-gaming-pro-wifi6e,22186.0,MSI,B850 GAMING PRO WIFI6E,AM5,ATX,AMD B850,256 GB,DDR5,4,"DDR5-4800, DDR5-8200",Black / Silver,4.0,,,,,"2280/22110 M-key, 2260/2280 M-key",,,,,4.0,1 x 2.5 Gb/s Ports (Realtek RTL8125D),Depends on CPU,2.0,,1.0,1.0,,No,Wi-Fi 6E,Yes,2026-01-20T11:26:04.341Z
Gigabyte B650I AORUS ULTRA Mini ITX AM5 Motherboard,https://cdna.pcpartpicker.com/static/forever/images/product/d24b8a128d98467e0dd3bc57882ddd55.256p.jpg,https://pcpartpicker.com/product/bYytt6/gigabyte-b650i-aorus-ultra-mini-itx-am5-motherboard-b650i-aorus-ultra,23062.0,Gigabyte,B650I AORUS ULTRA,AM5,Mini ITX,AMD B650,96 GB,DDR5,2,"DDR5-4400, DDR5-4800, DDR5-5200, DDR5-5600, DDR5-6000, DDR5-6200, DDR5-6400",Black / Silver,1.0,,,,,"2280 M-key, 2260/2280 M-key, 2280 M-key, 2230 E-key",,,,,4.0,1 x 2.5 Gb/s Ports (Intel),Depends on CPU,1.0,,1.0,,1.0,No,Wi-Fi 6E,Yes,2026-01-20T11:26:10.341Z
Asus PRIME A520M-K Micro ATX AM4 Motherboard,https://cdna.pcpartpicker.com/static/forever/images/product/744eea778bfa75c0307acf77a631c98a.256p.jpg,https://pcpartpicker.com/product/khcRsY/asus-prime-a520m-k-micro-atx-am4-motherboard-prime-a520m-k,,Asus,PRIME A520M-K,AM4,Micro ATX,AMD A520,64 GB,DDR4,2,"DDR4-2133, DDR4-2400, DDR4-2666, DDR4-2800, DDR4-3000, DDR4-3200, DDR4-3333, DDR4-3466, DDR4-3600, DDR4-3733, DDR4-3866, DDR4-4000, DDR4-4400, DDR4-4600",Black / Silver,1.0,,,2.0,,2242/2260/2280 M-key,,,,,4.0,1 x 1 Gb/s Ports (Realtek RTL8111H),Depends on CPU,2.0,,1.0,,,No,,Yes,2026-01-20T11:26:16.329Z
Asus ROG STRIX X870-F GAMING WIFI ATX AM5 Motherboard,,https://pcpartpicker.com/product/CpfxFT/asus-rog-strix-x870-f-gaming-wifi-atx-am5-motherboard-rog-strix-x870-f-gaming-wifi,50240.0,Asus,ROG STRIX X870-F GAMING WIFI,AM5,ATX,AMD X870,192 GB,DDR5,4,"DDR5-4800, DDR5-5000, DDR5-5200, DDR5-5400, DDR5-5600, DDR5-5800, DDR5-6000, DDR5-6200, DDR5-6400, DDR5-6600, DDR5-6800, DDR5-7000, DDR5-7200, DDR5-7400, DDR5-7600, DDR5-7800, DDR5-8000",Black,2.0,,,,,"2242/2260/2280 M-key, 2242/2260/2280 M-key, 2280 M-key, 2280 M-key",,,,,2.0,1 x 2.5 Gb/s Ports (Intel),Depends on CPU,2.0,,2.0,,1.0,No,Wi-Fi 7,Yes,2026-01-20T11:26:22.342Z
Gigabyte X870 GAMING WIFI6 ATX AM5 Motherboard,https://cdna.pcpartpicker.com/static/forever/images/product/2a78caa1159b44ac04ac0b6245d7a20b.256p.jpg,https://pcpartpicker.com/product/n3cgXL/gigabyte-x870-gaming-wifi6-atx-am5-motherboard-x870-gaming-wifi6,21602.0,Gigabyte,X870 GAMING WIFI6,AM5,ATX,AMD X870,256 GB,DDR5,4,"DDR5-4400, DDR5-4800, DDR5-5200, DDR5-5600, DDR5-6000, DDR5-6200, DDR5-6400, DDR5-6600, DDR5-6666, DDR5-6800, DDR5-7000, DDR5-7200, DDR5-7600, DDR5-7800, DDR5-8000, DDR5-8200",Black / Gray,3.0,,,,,"2580/25110 M-key, 2580/25110 M-key, 2580/25110 M-key",,,,,4.0,1 x 2.5 Gb/s Ports (Realtek),Depends on CPU,4.0,,1.0,,1.0,No,Wi-Fi 6,Yes,2026-01-20T11:26:29.343Z
MSI MPG B650I EDGE WIFI Mini ITX AM5 Motherboard,https://cdna.pcpartpicker.com/static/forever/images/product/67b21f33b930179c2c462faa514ae6f3.256p.jpg,https://pcpartpicker.com/product/DkFbt6/msi-mpg-b650i-edge-wifi-mini-itx-am5-motherboard-mpg-b650i-edge-wifi,25415.0,MSI,MPG B650I EDGE WIFI,AM5,Mini ITX,AMD B650,128 GB,DDR5,2,"DDR5-4800, DDR5-5000, DDR5-5200, DDR5-5400, DDR5-5600, DDR5-5800, DDR5-6000, DDR5-6200, DDR5-6400, DDR5-6600",Black / Silver,1.0,,,,,"2260/2280 M-key, 2260/2280 M-key",,,,,4.0,1 x 2.5 Gb/s Ports (Realtek RTL8125BG),Depends on CPU,1.0,,1.0,1.0,,No,Wi-Fi 6E,Yes,2026-01-20T11:26:35.332Z
Asus TUF GAMING B450-PLUS II ATX AM4 Motherboard,https://cdna.pcpartpicker.com/static/forever/images/product/fc1659aeb38b586449c2f9175141149d.256p.jpg,https://pcpartpicker.com/product/L2qBD3/asus-tuf-gaming-b450-plus-ii-atx-am4-motherboard-tuf-gaming-b450-plus-ii,17509.0,Asus,TUF GAMING B450-PLUS II,AM4,ATX,AMD B450,128 GB,DDR4,4,"DDR4-2133, DDR4-2400, DDR4-2666, DDR4-2800, DDR4-3000, DDR4-3200, DDR4-3466, DDR4-4400",Black,2.0,,,3.0,,"2242/2260/2280/22110 M-key, 2242/2260/2280 M-key",,,,,6.0,1 x 1 Gb/s Ports (Realtek L8200A),Depends on CPU,2.0,,1.0,,,No,,Yes,2026-01-20T11:26:43.342Z
Gigabyte B650 EAGLE ATX AM5 Motherboard,https://m.media-amazon.com/images/I/51uBI4K0gAL.jpg,https://pcpartpicker.com/product/vXcgXL/gigabyte-b650-eagle-atx-am5-motherboard-b650-eagle,24405.0,Gigabyte,B650 EAGLE,AM5,ATX,AMD B650,192 GB,DDR5,4,"DDR5-4400, DDR5-4800, DDR5-5200, DDR5-5600, DDR5-6000, DDR5-6200, DDR5-6400, DDR5-6600, DDR5-6800, DDR5-7000, DDR5-7200, DDR5-7600",Black / Gray,4.0,,,,,"2580/25110 M-key, 2280/22110 M-key, 2280/22110 M-key",,,,,4.0,1 x 1 Gb/s Ports (Realtek),Depends on CPU,3.0,,1.0,1.0,,No,,Yes,2026-01-20T11:26:49.329Z
ASRock X870 Pro-A WiFi ATX AM5 Motherboard,https://cdna.pcpartpicker.com/static/forever/images/product/caa52056a0445c27c97bb6debd9bcc24.256p.jpg,https://pcpartpicker.com/product/4bVfrH/asrock-x870-pro-a-wifi-atx-am5-motherboard-x870-pro-a-wifi,21427.0,ASRock,X870 Pro-A WiFi,AM5,ATX,AMD X870,256 GB,DDR5,4,"DDR5-4400, DDR5-8000",Black,4.0,,,,,"2280 M-key, 2280 M-key, 2280 M-key",,,,,4.0,1 x 2.5 Gb/s Ports (Realtek Dragon RTL8125BG),Depends on CPU,2.0,,2.0,1.0,,No,Wi-Fi 7,Yes,2026-01-20T11:26:55.331Z
Asus H110M-C/CSM Micro ATX LGA1151 Motherboard,https://m.media-amazon.com/images/I/513rvmJ5NzL.jpg,https://pcpartpicker.com/product/WF8H99/asus-motherboard-h110mccsm,7588.0,Asus,H110M-C/CSM,LGA1151,Micro ATX,Intel H110,32 GB,DDR4,2,"DDR4-1866, DDR4-2133",Black / Gold,1.0,,,2.0,1.0,,,,,,4.0,1 x 1 Gb/s Ports,Depends on CPU,1.0,,1.0,,,No,,No,2026-01-20T11:27:03.329Z
MSI Z390-A PRO ATX LGA1151 Motherboard,https://cdna.pcpartpicker.com/static/forever/images/product/65d2e2e1dd6c41fe051500c6d88ffe0c.256p.jpg,https://pcpartpicker.com/product/qpL48d/msi-z390-a-pro-atx-lga1151-motherboard-z390-a-pro,27792.0,MSI,Z390-A PRO,LGA1151,ATX,Intel Z390,128 GB,DDR4,4,"DDR4-2133, DDR4-2400, DDR4-2666, DDR4-2800, DDR4-3000, DDR4-3200, DDR4-3300, DDR4-3333, DDR4-3400, DDR4-3466, DDR4-3600, DDR4-3733, DDR4-3866, DDR4-4000, DDR4-4133, DDR4-4200, DDR4-4266, DDR4-4400",Brown / Black,2.0,,,4.0,,"2242/2260/2280/22110 M-key, 2230 E-key",,,,,6.0,1 x 1 Gb/s Ports,Depends on CPU,2.0,,2.0,,,No,,Yes,2026-01-20T11:27:11.329Z
ASRock B550M Phantom Gaming 4 Micro ATX AM4 Motherboard,https://cdna.pcpartpicker.com/static/forever/images/product/ec80afe70f19afab3d9c70d0a62e4104.256p.jpg,https://pcpartpicker.com/product/TG9tt6/asrock-b550m-phantom-gaming-4-micro-atx-am4-motherboard-b550m-phantom-gaming-4,11493.0,ASRock,B550M Phantom Gaming 4,AM4,Micro ATX,AMD B550,128 GB,DDR4,4,"DDR4-2133, DDR4-2400, DDR4-2666, DDR4-2933, DDR4-3200, DDR4-3466, DDR4-3600, DDR4-3733, DDR4-3800, DDR4-3866, DDR4-4000, DDR4-4133, DDR4-4200, DDR4-4266, DDR4-4333, DDR4-4400, DDR4-4533",Black,2.0,,,1.0,,"2280 M-key, 2280 M-key",,,,,4.0,1 x 1 Gb/s Ports (Realtek RTL8111H),Depends on CPU,2.0,,2.0,,,No,,Yes,2026-01-20T11:27:17.337Z
MSI PRO B850-P WIFI ATX AM5 Motherboard,https://cdna.pcpartpicker.com/static/forever/images/product/5b18758444f0beaee3b10e125a16688e.256p.jpg,https://pcpartpicker.com/product/Ypbypg/msi-pro-b850-p-wifi-atx-am5-motherboard-pro-b850-p-wifi,24522.0,MSI,PRO B850-P WIFI,AM5,ATX,AMD B850,256 GB,DDR5,4,"DDR5-4800, DDR5-5600, DDR5-6400, DDR5-8200",Silver / Black,4.0,,,,,"2260/2280 M-key, 2280/22110 M-key, 2260/2280 M-key",,,,,4.0,1 x 5 Gb/s Ports (Realtek 8126VB),Depends on CPU,2.0,,2.0,1.0,,No,Wi-Fi 7,Yes,2026-01-20T11:27:23.330Z
Asus PRIME B850-PLUS WIFI ATX AM5 Motherboard,,https://pcpartpicker.com/product/KmgZxr/asus-prime-b850-plus-wifi-atx-am5-motherboard-prime-b850-plus-wifi,21018.0,Asus,PRIME B850-PLUS WIFI,AM5,ATX,AMD B850,256 GB,DDR5,4,"DDR5-4800, DDR5-5200, DDR5-5600, DDR5-5800, DDR5-6000, DDR5-6200, DDR5-6400, DDR5-6600, DDR5-6800, DDR5-7000, DDR5-7200, DDR5-7400, DDR5-7600, DDR5-7800, DDR5-8000",Black / Silver,4.0,,,,,"2280 M-key, 2280 M-key, 2280 M-key",,,,,4.0,1 x 2.5 Gb/s Ports (Realtek),Depends on CPU,3.0,,1.0,1.0,,No,Wi-Fi 6E,Yes,2026-01-20T11:27:29.334Z
Asus PRIME B660-PLUS D4 ATX LGA1700 Motherboard,https://cdna.pcpartpicker.com/static/forever/images/product/5dd842664e7633f330f43db654431014.256p.jpg,https://pcpartpicker.com/product/32NxFT/asus-prime-b660-plus-d4-atx-lga1700-motherboard-prime-b660-plus-d4,26293.0,Asus,PRIME B660-PLUS D4,LGA1700,ATX,Intel B660,128 GB,DDR4,4,"DDR4-2133, DDR4-2400, DDR4-2666, DDR4-2800, DDR4-2933, DDR4-3000, DDR4-3200, DDR4-3333, DDR4-3400, DDR4-3466, DDR4-3600, DDR4-3733, DDR4-3866, DDR4-4000, DDR4-4266, DDR4-4400, DDR4-4600, DDR4-4800, DDR4-5000, DDR4-5066",Silver / Black,2.0,,,2.0,,"2242/2260/2280 M-key, 2242/2260/2280/22110 M-key, 2242/2260/2280 M-key, 2230 E-key",,,,,4.0,1 x 2.5 Gb/s Ports (Realtek),Depends on CPU,2.0,,1.0,1.0,,No,,Yes,2026-01-20T11:27:35.331Z
ASRock B650M PG RIPTIDE WIFI Micro ATX AM5 Motherboard,https://cdna.pcpartpicker.com/static/forever/images/product/6df39531014dfa084ccce11055f42764.256p.jpg,https://pcpartpicker.com/product/Ng2WGX/asrock-b650m-pg-riptide-wifi-micro-atx-am5-motherboard-b650m-pg-riptide-wifi,16347.0,ASRock,B650M PG RIPTIDE WIFI,AM5,Micro ATX,AMD B650,256 GB,DDR5,4,"DDR5-4800, DDR5-5200, DDR5-5600, DDR5-6000, DDR5-6200, DDR5-6400, DDR5-6600, DDR5-6800, DDR5-7000, DDR5-7200",Black,2.0,,,2.0,,"2260/2280 M-key, 2260/2280 M-key, 2230 E-key",,,,,4.0,1 x 2.5 Gb/s Ports (Realtek Dragon RTL8125BG),Depends on CPU,2.0,,2.0,1.0,,No,Wi-Fi 6E,Yes,2026-01-20T11:27:41.329Z
ASRock B850 Pro-A ATX AM5 Motherboard,https://cdna.pcpartpicker.com/static/forever/images/product/93789ab3bb348cbcc17fe4a6cd5b6d81.256p.jpg,https://pcpartpicker.com/product/tccBD3/asrock-b850-pro-a-atx-am5-motherboard-b850-pro-a,19617.0,ASRock,B850 Pro-A,AM5,ATX,AMD B850,256 GB,DDR5,4,"DDR5-4400, DDR5-4800, DDR5-5200, DDR5-5600, DDR5-6000, DDR5-6200, DDR5-6400, DDR5-6600, DDR5-6800, DDR5-7000, DDR5-7200, DDR5-7600, DDR5-7800, DDR5-8000",Black / Silver,2.0,,,,,"2280 M-key, 2280 M-key, 2230/2242/2260/2280 M-key, 2280 M-key, 2230 E-key",,,,,4.0,1 x 2.5 Gb/s Ports (Realtek Dragon RTL8125BG),Depends on CPU,1.0,1.0,1.0,,1.0,No,,Yes,2026-01-20T11:27:47.334Z
Gigabyte B550M DS3H R2 Micro ATX AM4 Motherboard,,https://pcpartpicker.com/product/ptnXsY/gigabyte-b550m-ds3h-r2-micro-atx-am4-motherboard-b550m-ds3h-r2,,Gigabyte,B550M DS3H R2,AM4,Micro ATX,AMD B550,128 GB,DDR4,4,"DDR4-2133, DDR4-2400, DDR4-2666, DDR4-2933, DDR4-3200",Black,2.0,,,1.0,,"2280 M-key, 2280 M-key",,,,,4.0,1 x 1 Gb/s Ports (Realtek),Depends on CPU,1.0,,1.0,1.0,,No,,Yes,2026-01-20T11:27:53.334Z
Asus Z790-AYW WIFI W II ATX LGA1700 Motherboard,https://cdna.pcpartpicker.com/static/forever/images/product/b22deeb4627bdcc5bb070b2f51cbe5b6.256p.jpg,https://pcpartpicker.com/product/qC62FT/asus-z790-ayw-wifi-w-ii-atx-lga1700-motherboard-z790-ayw-wifi-w-ii,18683.0,Asus,Z790-AYW WIFI W II,LGA1700,ATX,Intel Z790,192 GB,DDR5,4,"DDR5-4800, DDR5-5000, DDR5-5200, DDR5-5400, DDR5-5600, DDR5-5800, DDR5-6000, DDR5-6200, DDR5-6400, DDR5-6600, DDR5-6800, DDR5-7000, DDR5-7200, DDR5-7400, DDR5-7600, DDR5-7800, DDR5-8000",White,4.0,,,1.0,,"2280/22110 M-key, 2280 M-key, 2242/2260/2280/22110 M-key",,,,,4.0,1 x 2.5 Gb/s Ports (Realtek),Depends on CPU,2.0,,2.0,1.0,,No,Wi-Fi 6,Yes,2026-01-20T11:28:00.332Z
MSI B850M GAMING PLUS WIFI6E Micro ATX AM5 Motherboard,,https://pcpartpicker.com/product/KtLp99/msi-b850m-gaming-plus-wifi6e-micro-atx-am5-motherboard-b850m-gaming-plus-wifi6e,28375.0,MSI,B850M GAMING PLUS WIFI6E,AM5,Micro ATX,AMD B850,256 GB,DDR5,4,"DDR5-4800, DDR5-8200",Silver / White,1.0,,,2.0,,"2260/2280 M-key, 2260/2280 M-key",,,,,4.0,1 x 2.5 Gb/s Ports (Realtek RTL8125D),Depends on CPU,2.0,,1.0,1.0,,No,Wi-Fi 6E,Yes,2026-01-20T11:28:07.329Z
MSI MAG Z890 TOMAHAWK WIFI ATX LGA1851 Motherboard,https://cdna.pcpartpicker.com/static/forever/images/product/c4627c92bb33a5c35c247e2b415d25ed.256p.jpg,https://pcpartpicker.com/product/BW26Mp/msi-mag-z890-tomahawk-wifi-atx-lga1851-motherboard-mag-z890-tomahawk-wifi,36199.0,MSI,MAG Z890 TOMAHAWK WIFI,LGA1851,ATX,Intel Z890,256 GB,DDR5,4,"DDR5-4800, DDR5-5000, DDR5-5200, DDR5-5400, DDR5-5600, DDR5-5800, DDR5-6000, DDR5-6200, DDR5-6400, DDR5-6600, DDR5-6800, DDR5-7000, DDR5-7200, DDR5-7400, DDR5-7600, DDR5-7800, DDR5-8000, DDR5-8200, DDR5-8400, DDR5-8600, DDR5-8800, DDR5-9000, DDR5-9200",Black / Yellow,3.0,,,,,"2260/2280 M-key, 2260/2280/22110 M-key, 2242/2260/2280 M-key, 2242/2260/2280 M-key",,,,,4.0,1 x 5 Gb/s Ports (Intel Killer E5000B),Depends on CPU,2.0,,1.0,,1.0,No,Wi-Fi 7,Yes,2026-01-20T11:28:14.334Z
MSI MPG B850 EDGE TI WIFI ATX AM5 Motherboard,https://cdna.pcpartpicker.com/static/forever/images/product/96e46dd70c74cd0a13c6e161f4a0fa72.256p.jpg,https://pcpartpicker.com/product/fKZWGX/msi-mpg-b850-edge-ti-wifi-atx-am5-motherboard-mpg-b850-edge-ti-wifi,26857.0,MSI,MPG B850 EDGE TI WIFI,AM5,ATX,AMD B850,256 GB,DDR5,4,"DDR5-4800, DDR5-5600, DDR5-6400, DDR5-8400",Silver / White,3.0,,,,,"2280/22110 M-key, 2260/2280 M-key, 2260/2280 M-key, 2260/2280 M-key",,,,,4.0,1 x 5 Gb/s Ports (Realtek RTL8126),Depends on CPU,2.0,,2.0,,1.0,No,Wi-Fi 7,Yes,2026-01-20T11:28:20.329Z
